[
  {
    "code": "en-US",
    "name": "English (United States)",
    "base_language": "en",
    "primary_model": "Qwen/Qwen2.5-7B-Instruct",
    "alternative_models": [
      "CohereForAI/aya-expanse-8b"
    ],
    "insights": [
      {
        "points": [
          "American spelling: color, honor, organize (not colour, honour, organise)",
          "Informal tone acceptable in most advertising contexts",
          "Active voice and direct phrasing preferred",
          "Contractions common and natural (it's, you're, we've)"
        ],
        "heading": "Language characteristics"
      }
    ],
    "notes": "",
    "is_active": true
  },
  {
    "code": "en-GB",
    "name": "English (United Kingdom)",
    "base_language": "en",
    "primary_model": "Qwen/Qwen2.5-7B-Instruct",
    "alternative_models": [
      "CohereForAI/aya-expanse-8b"
    ],
    "insights": [],
    "notes": "",
    "is_active": true
  },
  {
    "code": "en-CA",
    "name": "English (Canada)",
    "base_language": "en",
    "primary_model": "Qwen/Qwen2.5-7B-Instruct",
    "alternative_models": [
      "CohereForAI/aya-expanse-8b"
    ],
    "insights": [
      {
        "points": [
          "Canadian spelling: colour, honour, centre (British-influenced)",
          "Mix of British and American vocabulary: 'truck' (US) but 'tap' not 'faucet' (UK)",
          "Distinct idioms: 'toque' (winter hat), 'parkade' (parking garage)",
          "'Eh?' as conversation filler characteristic but avoid stereotyping"
        ],
        "heading": "Language characteristics"
      }
    ],
    "notes": "",
    "is_active": true
  },
  {
    "code": "en-AU",
    "name": "English (Australia)",
    "base_language": "en",
    "primary_model": "Qwen/Qwen2.5-7B-Instruct",
    "alternative_models": [],
    "insights": [],
    "notes": "",
    "is_active": true
  },
  {
    "code": "en-NZ",
    "name": "English (New Zealand)",
    "base_language": "en",
    "primary_model": "Qwen/Qwen2.5-7B-Instruct",
    "alternative_models": [],
    "insights": [],
    "notes": "",
    "is_active": true
  },
  {
    "code": "en-IE",
    "name": "English (Ireland)",
    "base_language": "en",
    "primary_model": "Qwen/Qwen2.5-7B-Instruct",
    "alternative_models": [],
    "insights": [],
    "notes": "",
    "is_active": true
  },
  {
    "code": "en-ZA",
    "name": "English (South Africa)",
    "base_language": "en",
    "primary_model": "Qwen/Qwen2.5-7B-Instruct",
    "alternative_models": [],
    "insights": [],
    "notes": "",
    "is_active": true
  },
  {
    "code": "en-IN",
    "name": "English (India)",
    "base_language": "en",
    "primary_model": "Qwen/Qwen2.5-7B-Instruct",
    "alternative_models": [],
    "insights": [],
    "notes": "",
    "is_active": true
  },
  {
    "code": "es-ES",
    "name": "Spanish (Spain)",
    "base_language": "es",
    "primary_model": "Qwen/Qwen2.5-7B-Instruct",
    "alternative_models": [],
    "insights": [
      {
        "points": [
          "Uses 'vosotros' for plural 'you' (not used in Latin America)",
          "Ceceo/distinción: 'c' and 'z' pronounced differently than in LATAM",
          "Castilian vocabulary: 'coche' (car), 'ordenador' (computer)",
          "Formal 'usted' for advertising unless youth-targeted"
        ],
        "heading": "Language characteristics"
      }
    ],
    "notes": "",
    "is_active": true
  },
  {
    "code": "es-MX",
    "name": "Spanish (Mexico)",
    "base_language": "es",
    "primary_model": "Qwen/Qwen2.5-7B-Instruct",
    "alternative_models": [
      "CohereForAI/aya-expanse-8b",
      "mistralai/Mistral-7B-Instruct-v0.3"
    ],
    "insights": [
      {
        "points": [
          "Car: 'carro' (MX) vs 'coche' (ES) vs 'auto' (AR)",
          "Computer: 'computadora' (MX) vs 'ordenador' (ES)",
          "Bus: 'camión' (MX) vs 'autobús' (ES)",
          "Avoid Castilian 'vosotros' - use 'ustedes' for plural 'you'"
        ],
        "heading": "Vocabulary and expressions"
      },
      {
        "points": [
          "Informal 'tú' acceptable in advertising",
          "Diminutives common and affectionate: '-ito/-ita' endings",
          "Regional slang varies within Mexico - neutral Mexican Spanish for broad reach"
        ],
        "heading": "Cultural expressions"
      }
    ],
    "notes": "",
    "is_active": true
  },
  {
    "code": "es-AR",
    "name": "Spanish (Argentina)",
    "base_language": "es",
    "primary_model": "Qwen/Qwen2.5-7B-Instruct",
    "alternative_models": [],
    "insights": [],
    "notes": "",
    "is_active": true
  },
  {
    "code": "es-CO",
    "name": "Spanish (Colombia)",
    "base_language": "es",
    "primary_model": "Qwen/Qwen2.5-7B-Instruct",
    "alternative_models": [],
    "insights": [],
    "notes": "",
    "is_active": true
  },
  {
    "code": "es-CL",
    "name": "Spanish (Chile)",
    "base_language": "es",
    "primary_model": "Qwen/Qwen2.5-7B-Instruct",
    "alternative_models": [],
    "insights": [],
    "notes": "",
    "is_active": true
  },
  {
    "code": "es-PE",
    "name": "Spanish (Peru)",
    "base_language": "es",
    "primary_model": "Qwen/Qwen2.5-7B-Instruct",
    "alternative_models": [],
    "insights": [],
    "notes": "",
    "is_active": true
  },
  {
    "code": "fr-FR",
    "name": "French (France)",
    "base_language": "fr",
    "primary_model": "Qwen/Qwen2.5-7B-Instruct",
    "alternative_models": [
      "CohereForAI/aya-expanse-8b",
      "mistralai/Mistral-7B-Instruct-v0.3"
    ],
    "insights": [
      {
        "points": [
          "Formal register (vous) expected in most advertising",
          "Informal (tu) reserved for youth-oriented or digital-native contexts",
          "Avoid excessive Anglicisms - French equivalents preferred",
          "Subjunctive mood and formal constructions common"
        ],
        "heading": "Language characteristics"
      }
    ],
    "notes": "",
    "is_active": true
  },
  {
    "code": "fr-CA",
    "name": "French (Canada)",
    "base_language": "fr",
    "primary_model": "Qwen/Qwen2.5-7B-Instruct",
    "alternative_models": [
      "CohereForAI/aya-expanse-8b"
    ],
    "insights": [
      {
        "points": [
          "Car: 'char' (QC) vs 'voiture' (FR)",
          "Breakfast: 'déjeuner' (QC) vs 'petit-déjeuner' (FR)",
          "Weekend: 'fin de semaine' (QC) vs 'weekend' (FR)",
          "Parking: 'stationnement' (QC) vs 'parking' (FR)",
          "Email: 'courriel' (QC) vs 'mail/email' (FR)"
        ],
        "heading": "Vocabulary differences from France"
      },
      {
        "points": [
          "Quebec French has distinct phonology - MUST use Quebec VO talent, not European",
          "Local idioms: 'C'est le fun' (it's fun), 'Tiguidou' (great/okay)",
          "Informal 'tu' more common than formal 'vous' in advertising",
          "Sacres (religious swear words) exist but avoid in advertising"
        ],
        "heading": "Pronunciation and idioms"
      },
      {
        "points": [
          "Office québécois de la langue française enforces French language use",
          "Bill 101 (Charter of the French Language) sets commercial French requirements",
          "Bill 96 mandates French text at least 2x size of English",
          "All product descriptions, warnings, and supers MUST be in French"
        ],
        "heading": "Legal and compliance"
      }
    ],
    "notes": "",
    "is_active": true
  },
  {
    "code": "fr-BE",
    "name": "French (Belgium)",
    "base_language": "fr",
    "primary_model": "Qwen/Qwen2.5-7B-Instruct",
    "alternative_models": [
      "CohereForAI/aya-expanse-8b"
    ],
    "insights": [
      {
        "points": [
          "Belgian French closer to France French than Quebec French",
          "Distinct vocabulary: 'septante' (70), 'nonante' (90) instead of soixante-dix, quatre-vingt-dix",
          "Formal 'vous' expected in advertising",
          "Flemish influence in Brussels - bilingual considerations"
        ],
        "heading": "Language characteristics"
      }
    ],
    "notes": "",
    "is_active": true
  },
  {
    "code": "fr-CH",
    "name": "French (Switzerland)",
    "base_language": "fr",
    "primary_model": "Qwen/Qwen2.5-7B-Instruct",
    "alternative_models": [],
    "insights": [
      {
        "points": [
          "Swiss French (Romandie) uses 'septante' (70), 'huitante' (80), 'nonante' (90)",
          "Distinct expressions and vocabulary vs France French",
          "Formal and precise language expected",
          "Understatement and discretion valued in Swiss culture"
        ],
        "heading": "Language characteristics"
      }
    ],
    "notes": "",
    "is_active": true
  },
  {
    "code": "de-DE",
    "name": "German (Germany)",
    "base_language": "de",
    "primary_model": "mistralai/Mistral-7B-Instruct-v0.3",
    "alternative_models": [
      "Qwen/Qwen2.5-7B-Instruct"
    ],
    "insights": [
      {
        "points": [
          "Formal address (Sie) expected in most advertising",
          "Compound words common - keep messaging concise",
          "Precision and accuracy valued - avoid vague claims",
          "Gender-neutral language increasingly expected"
        ],
        "heading": "Language characteristics"
      }
    ],
    "notes": "",
    "is_active": true
  },
  {
    "code": "de-AT",
    "name": "German (Austria)",
    "base_language": "de",
    "primary_model": "mistralai/Mistral-7B-Instruct-v0.3",
    "alternative_models": [],
    "insights": [
      {
        "points": [
          "Greeting: 'Grüß Gott' (AT) vs 'Hallo/Guten Tag' (DE)",
          "January: 'Jänner' (AT) vs 'Januar' (DE)",
          "Potato: 'Erdapfel' (AT) vs 'Kartoffel' (DE)",
          "Tomato: 'Paradeiser' (AT) vs 'Tomate' (DE)"
        ],
        "heading": "Vocabulary differences from Germany"
      }
    ],
    "notes": "",
    "is_active": true
  },
  {
    "code": "de-CH",
    "name": "German (Switzerland)",
    "base_language": "de",